Number;Speaker;Start time;End time;Duration;Text
55;Simba Khadder;00:18:49.690;00:19:25.120;00:00:35.430;"I'm curious, when I talk to the SaaS teams, most of the time for using pandas or something data frame related, or using notebooks, a lot of the work is experimentation. And they treat the deployment as a server issue really cool. I experiment, I do all that stuff, and then finally I switch my hat into deploy mode and I go into deployment. And it seems like I guess the workflow you've mentioned, or at least the tools you mentioned, like Metaflow and Snowflake and all of those tooling, they're more oriented towards deployment and less experimentation. One, do you buy that? Do you feel like there's this distinction?"
56;Jacopo Tagliabue;00:19:25.120;00:19:44.740;00:00:19.620;"My friend Ville, which is one of the creator of Metaflow, said one of the smartest thing that everybody's ever said about MLOps, which is production ready, is a continuum. Of course, that comes from his life on Netflix, which is a very advanced company that understands this very well and makes people productive in that sense. But you need to understand this to be a good ML practitioner."
57;Jacopo Tagliabue;00:19:44.740;00:20:11.460;00:00:25.760;"Production ready is a continuum. There's not such a thing as experimental and production ready. There's a thing of something that works and it's okay to run on 5% of my traffic or even to just 1% of my traffic for a day, collect manually the results and then iterating going there. And then that's something that is like, well, or 30% of our user for an entire week and see how that goes. And then there's a full fledged thing of, hey, now let's serve all Netflix."
58;Jacopo Tagliabue;00:20:11.460;00:20:26.130;00:00:14.670;"The good tools are the one that scales automatically to this and Metaflow is a very good example. Metaflow is good for local experimentation and with one click you can deploy on the cloud. Now it runs every day if you want to run it at any scale you want up to a certain limit."
59;Jacopo Tagliabue;00:20:26.290;00:20:45.920;00:00:19.790;"So it's the same tool that stays with you from the notebook phase to an endpoint running in production. But the crucial aspect here is you have to train your team to think about the constant iteration, not about two separate phases. Because at the end of the day, there's no judge of an ML model like production. People need to test in production."
60;Jacopo Tagliabue;00:20:45.920;00:21:20.670;00:00:34.750;"There's a meme when there's the normal distribution and there's people to the left, there's people to the right of the normal distribution. So the people not super smart and the people that are super smart. The people to the left and the people to the right are going to say, ""Testing production"", and the people in the middle are going to be the normal people saying, ""No, you have to test on an offline set."" That's all good and well. But at the end of the day, real people testing production. That's a super important thing culturally that needs to happen in your company. And the shorter the time from your idea to production, with all the guideline and safeguards, of course, that they're needed, but the shorter the time, the better ML company you will be."
61;Jacopo Tagliabue;00:21:20.670;00:21:48.030;00:00:27.360;"That's a secret to good ML teams. ML teams can do end-to-end from their laptop to production without asking anybody. Without asking DevOps, without asking lawyers, without asking security. And that's why they're a good ML team, because in the time when everybody else is waiting for a DevOps person to deploy infrastructure, they're going to have iterated it three times in their model. So that's for me is a key. I don't buy the distinction between laptop and cloud. It's one thing for me. It just a set of degree of the amount of guidelines that you need to put in place."
62;Simba Khadder;00:21:48.030;00:22:17.070;00:00:29.040;"I 100% agree. It's something that we think a lot about with our product. I think it's interesting because I actually haven't had anyone say that before. It's something that I've come to believe it's just that these phases need to be combined. A lot of people are like, yeah, notebooks are great for experimentation but they're not good for deployment. And that's true. Or I think it's true. But it's not a black and white thing. There needs to be a way to naturally transform what you're doing with the notebook to deployment. Like in our case, in the notebook, you can push features and training sets."
63;Simba Khadder;00:22:17.070;00:22:48.290;00:00:31.220;"You make me think of interesting points. I love the example of pushing a production. It's something we actually built too. I'm not surprised Netflix does. Netflix is obviously deployments like Chaos Monkey, which comes from the same, I guess philosophy of testing for production. We used to do the same thing with our recommended system. Every time we'd have a model that we thought would work, we would hit a button and it would immediately go to 1% of the audience and it would grow and shrink according to things. We'd always make sure we always at least had two because we were afraid to do one and accidentally pigeonhole our recommendations too far."
64;Simba Khadder;00:22:48.290;00:22:58.490;00:00:10.200;"So we had all these things we built. It's not something I've ever seen mentioned. Sometimes I'm like, ""I can't believe our own people who built this."" But I've never seen laws talk about this thing, and it was a key piece of our infrastructure."
65;Simba Khadder;00:22:58.600;00:23:37.410;00:00:38.810;"The last thing I'll add, someone told me once that the greatest adversarial network you will ever find is the Internet. If you put a recommended system out, you can bet that there's a whole very smart, very sophisticated team of humans, decentralizingly trying to break it, like Google search. There's always a billion people in the world trying to game the system. So you have to deal with the most smart adversial network you can create. When you talk about the degrees of ready for prod, is that what you guys do today? Do you do things that try out different users? Does it apply outside of recommended systems? How do you think about that? Or I would love for you to expand on it."
66;Jacopo Tagliabue;00:23:37.410;00:24:03.720;00:00:26.310;"You interrupt the general principles. Then of course, what your company does. The crucial difference between B2C companies like Netflix and B2B companies like [inaudible 00:23:45] or [inaudible 00:23:46] whatever is that you serve different customers that are shops, but you don't control anything that happens between that shop and the final user of the shoppers. So what you build is a recommender system is going to be used by users. But user, they're not your user. These are your customer user. Just subtle distinction."
67;Jacopo Tagliabue;00:24:03.720;00:24:26.030;00:00:22.310;"So it means that there's a limit to things that you can do both in the fact that you don't control the final UI because of course, you just provide an API as a SaaS platform and then the company does whatever it wants with it. That's why they pay you. And the second thing is that there's a limit, both contractual but also more philosophical, like ethical limit. The number of experiments you can run when there is the complement between you and the final shoppers."
68;Jacopo Tagliabue;00:24:26.180;00:24:34.140;00:00:07.960;"At some point, you need to take that idea of production ready is a continuum of-fine Ville, thank you very much for the tagline-and then make it work for your own company."
69;Jacopo Tagliabue;00:24:34.140;00:25:08.250;00:00:34.110;"But I think especially in the last couple of years, the MLOps team that I worked with at Coveo, incredible, very significant step forward toward realizing that vision. Part of that was culture, of course; being good to adopt this new way of adopting stuff, of course. And part of that was MLOps tool that would make this something that can happen in months and not in years. Even large companies like in a thousand-people public company, thanks to the metaphor of this word, you can think of making this culture shift at a relatively low price so that people are also more encouraged to see a new way of doing things. You know what I mean?"
70;Jacopo Tagliabue;00:25:08.250;00:25:42.860;00:00:34.610;"If you're going to say to people, ""Hey, this is a fantastic new way of doing stuff, but now we have to go to the Mount Everest to achieve this"", it's going to take a lot of convincing, a lot of things to go around. But if it's like, ""Hey, but you can just start with these open source stuff. We can start with one model, but we need to change our entire thing. Let's start with one specific use cases, import it to this new way of doing things, and then we enlarge from that."" But you need people to get behind you and build it. So, again, demand and supply. The companies are more ready to have sophisticated tools in place. And then supply. Honestly, there are very good tools now that actually make these choices even a no brainer compared to three years ago."
71;Simba Khadder;00:25:42.860;00:25:45.020;00:00:02.160;"What are you most excited about in MLOps?"
72;Jacopo Tagliabue;00:25:45.340;00:26:06.440;00:00:21.420;"There's a bunch of things that I think are still open question and I would love to see more companies tackle this. So to my topics that I really like and I'm excited to see what the community is going to do in the next couple of years. One is testing, which of course is something that I have also a vested interest in as the quarter of list and the [inaudible 00:26:04] challenge and so on and so forth."
73;Jacopo Tagliabue;00:26:06.600;00:26:44.600;00:00:38.000;"I believe we really suck at testing recommender system, but more general testing ML systems. And the idea that your ML system is defined by a one metric, MLR and the CG on an L doubt test set, is a profoundly misleading idea. So the idea that our generalization capability, the idea that we can predict what the model is going to do in the wild with this number is really not doing a good service to the field. Of course, again, I also contributed as an open source and a scholar to this problem, and then we'll continue to do so with the team. But I would love for this to become one of the central actual discussion about ML."
74;Jacopo Tagliabue;00:26:44.600;00:27:07.710;00:00:23.110;"As more people doing ML, the barrier to entry gets lower. More models are going to be in production changing the world and changing user behavior. So testing is going to be more important, not less. And I feel there's nearly not enough discussion. There's still a lot of discussion about models or about GPUs, but not enough discussion on how to test properly your model. So that's topic number one, which I really like to see what the community is going to go."
75;Jacopo Tagliabue;00:27:07.710;00:27:42.440;00:00:34.730;"And topic number two, which you mentioned, is experimental platform. As you said, it's impossible that people don't talk more about this fact that you have to have two models always competing with each other and so on. But the truth of the matter, there's no open source or there's not even a real experimental platform out there for people doing ML. There's a optimizing tool for people changing the color of a button in a UI. There's tons of options for that. But there's no experimental platform like the Stitch Fix or the Netflix of this world. It is designed for people sending complex models into production and understanding how this model behave."
76;Jacopo Tagliabue;00:27:42.440;00:27:59.630;00:00:17.190;"So somehow an experimental factor for the backend, not for the UX, I would love for somebody to build a company in that space or at least to build a framework at least to raise awareness of how important that is for the community. Because building one yourself and you know it, because you did, it's a lot of work. You would totally offload to somebody else if it was possible."
77;Simba Khadder;00:27:59.830;00:28:29.840;00:00:30.210;"I wonder if those two things could be combined, actually. Testing and experimentation, it almost feels like there's something there. Anyway, I love that. I think that's very interesting. And for someone listening who's motivated to own an MLOps company and thinking about what I did to build, there's two great ones. I thought we'd keep talking forever. But I do want to put a bow on this. Maybe last thing. If you have to give a tweet leaf takeaway, almost a TL;DR for someone who listened to this and is like, ""This is amazing, I need to go tell my team about this."" What should they say?"
78;Jacopo Tagliabue;00:28:29.840;00:28:54.900;00:00:25.060;"My suggestion is always the same is, A, it's a fantastic moment to be machine learning because you don't have to do much. So first point is you think this get started with his own machine learning thing, it's super hard. It's not trivial, I granted you, but it's not nearly as complex as five years ago. So this a fantastic moment for people to get started. And there's a lot of materials that you can start from; yours, mine, for example, but there's tons of other fantastic material."
79;Jacopo Tagliabue;00:28:54.900;00:29:23.550;00:00:28.650;"The second point that I would say the second tweet is, start with the problem you have and the stack cover now, not the one you wish you had. I think a lot of people get overwhelmed by the idea. Oh, wow, but this one's scaled when we were Facebook. I'm like, ""Maybe, but you're not Facebook now. And if you're ever going to get there, it's an epic problem we're thinking about."" Think about your recommender system now or now in six months, now in a year. Don't try to overengineer this entire thing for a future that may never materialize."
80;Jacopo Tagliabue;00:29:24.630;00:30:00.400;00:00:35.770;"Metaflow is always the same. I see a lot of people in this space that are trying to start playing tennis. And the only thing they consume is Roger Federer training which is amazing. Roger Federer training is very inspiring, but it doesn't have any bearing with learning how to do a frontend and a backend right now. Right now you need a frontend, a backend, and a Volley that are solid. Chances are you're never going to become Roger Federer. And even if you become a professional, there's going to be some year from now in time. Thanks, Roger, for all the amazing things that you did, but for me, right now as tennis player, I just need to eat a hundred frontend, and get them on the other side. So focus on that. Then if you're a Roger Federer, we'll figure that out when time comes."
81;Simba Khadder;00:30:00.400;00:30:23.670;00:00:23.270;"To expand on that, I bet you if you think, would you know what it takes when you're him to do it? That you'd look back in five years if you make it that far and be like ""Wow, do you believe that we thought that was what we're going to do?"" Even if you do get there, you're probably wrong. So why waste your time thinking about that and just focus at the problem end? I love that. That's an awesome analogy. Jacopo, it's been so great chatting with you. Thanks for hoping on."
82;Jacopo Tagliabue;00:30:23.670;00:30:27.950;00:00:04.280;"Oh, thanks so much for having me and thanks for everybody for listening."
