Number;Speaker;Start time;End time;Duration;Text
0;Simba Khadder;00:00:06.000;00:00:27.450;00:00:21.450;"Hey, I'm Simba Khadder, and you're listening to the MLOps weekly podcast. Today I'm chatting with Stefan Krawczyk, former Manager of Data Platform, at Stitch Fix. He built, and later opened source to Hamilton Framework while he was there. Prior to that, he was an employee at LinkedIn, Nextdoor and NLP enterprise start-up that, in his own words, crashed and burned. Stefan, so good to have you on the show today."
1;Stefan Krawczyk;00:00:27.690;00:00:29.430;00:00:01.740;"Yeah, thanks for having me, Simba. Excited."
2;Simba Khadder;00:00:29.580;00:00:35.160;00:00:05.580;"I gave a quick outline of how you got to MLOps, but I'd love to hear it in your own words. What was your story that got you MLOps?"
3;Stefan Krawczyk;00:00:35.640;00:01:36.360;00:01:00.720;"How do I get in to MLOps? Well, I originally did computer science at Stanford and I had specialization, so I knew I wanted to do something around this new field of ML, AI. I guess that. At LinkedIn I pivoted to prototyping content based recommendation products. I got firsthand experience, what it's like to build a bottle and try to get it out to production. At Nextdoor, I built similar things and related tools of technology. First version of data warehouse then we could build and get data to try and model with and online experimentation, A/B testing frameworks and so. That's what led me to go to the startup because I wanted to get better at machine learning frameworks because I really wanted to understand how to operate them, how to build them except that was for future. Then the opportunity came up with Stitch Fix was, come and help build a machine learning platform because that's why MLOps was coined. That was, I think, people were trying to build machine learning platforms and so that's what I was interested in doing. While at Stitch Fix, I was building a little more than just a platform but trying to help data scientists build, get things to production themselves."
4;Stefan Krawczyk;00:01:36.660;00:01:47.220;00:00:10.560;"The MLOps term was coined so it was great. This is like the easiest way that I can explain to someone what me and my team does. We're trying to help. Data scientists operationalize machine learning in a way that's self-service."
5;Simba Khadder;00:01:48.740;00:02:19.540;00:00:31.900;"I love a lot of these terms. Like, [inaudible 00:01:50] with feature store. Well, define a feature store to someone and they're like, ""Oh yeah, we have that."" Everyone built all these things. Anyone who's been doing machine learning production has been doing MLOps forever. We didn't call it that and we didn't really even think about it that way. We don't really break it down in that way. It was just the platform for machine learning. For us, the feature store was something we used called it our data platform for machine learning. It wasn't the feature store that came later and we said, ""Yeah, that's what we built, it's a feature store."""
6;Stefan Krawczyk;00:02:20.760;00:02:52.560;00:00:33.160;"Yeah. I think it's similar to how DevOps came about. Rather than handing off, you're now trying to go do things yourself in the best practices way to get things to production. In which case, adding a feature store and thinking about features and models and data, it's all ecosystem. In which case, it makes sense. I was happy that whoever came up with that came up with that. I'm like, ""This is great. This makes my job much easier to explain."" Thinking about the software engineering best practices and again trying to bring in the DevOps mindset of how do you operationalize things without breaking production, you want to stop bad things from happening so what's a good way to think about and do it."
7;Simba Khadder;00:02:53.160;00:03:00.030;00:00:07.170;"You've answered this question, but I wanted to ask you so it's discrete for anyone listening. How would you define MLOps?"
8;Stefan Krawczyk;00:03:00.180;00:03:31.680;00:00:31.500;"You're sort of riffing on what I just said before. For me, the whole goal, the mindset of MLOps is to stop bad things from happening in production but you're doing it in and approaching it in such a way that you're bringing what's termed developer operations or DevOps, best practices for deploying and getting to production. But then you're also thinking about software engineering best practices because machine learning is also data and code that then you ship and package together. It's really the mindset of how do you stop bad things from happening production and then what are the techniques and ways and framings that you can employ to make that happen."
9;Simba Khadder;00:03:32.070;00:03:53.190;00:00:21.120;"I love that you brought up DevOps. It's interesting to see how everyone's view of MLOps, which is DevOps, are obviously different things, but some people say they're completely different. Other people are like, it's just the same thing, applied in different places. Some people I've talked to, some people are like, it's like 90% the same. MLOps doesn't even have to exist. How would you define like the difference between MLOps and DevOps?"
10;Simba Khadder;00:03:53.370;00:04:37.110;00:00:43.740;"For me, DevOps when I encountered it, it was rather than it being someone else's job function, a job role, rather to deploy my code, I now as a developer, I deploying it myself. For me, MLOps is, if you think about if you take DevOps next mindset. How do you enable someone to develop and deploy and develop things as part of the job function. Then I think to me, that's similar to the MLOps mindset. Now DevOps, I want to say it's probably right now to me, it's actually a subset of MLOps because if you think about deploying production, then maybe there's a little bit of this disjointness in DevOps because it's focus is on things that deployments would never be in machine learning deployments. I think, right now, once DevOps is a subset of the other and helps feed into… Any best practices in DevOps, I'm pretty sure you can bring them back in MLOps."
11;Simba Khadder;00:04:37.620;00:05:30.990;00:00:53.880;"I love that. It's funny that in the last episode we had James, who's an investor. He said, ""One open question is the size of the DevOps market vs MLOps market."" You're not exactly saying that but I love the idea of that MLOps market is the superset, it's DevOps and more. Putting models of production, it hits every pain point of DataOps, DevOps and all of these other things in between so you're right. I can't imagine someone having a really good MLOps workflow also have amazing DevOps workflow, same with DataOps. It's almost like you need both as a foundation and then you need to find a way to apply that for your machine learning team, to get all working together as a MLOps. Could you share some things that manifested in what makes… so putting a service in production versus putting them all in production, could you talk about, we dissolve differences. Could you talk about, maybe a story of something that happened, that could only happen in machine learning but you have to solve?"
12;Stefan Krawczyk;00:05:32.220;00:06:50.190;00:01:17.970;"What's a model? Think about it from first principles in terms of, you want to predict something while there's going to be some function somewhere that you pass some data in and then that function actually has some state as some internal state. That is [inaudible 00:05:46] model and so it's together with the inputs you're then transforming and using, computing something with that internal state and outputting a result. If in traditional software engineering and apps or services, there isn't really any internal state. It's all pretty invariant and very easy to reason about the inputs that you get and the outputs so you can write. As long as you have great unit test coverage, pretty much could something wrong it can go wrong in production with your app, but with MLOps and machine learning model into production, I think, you have to really think about all the different… There are so many things that could go wrong. I wouldn't say it's if you have a model rather the time… There are so many components to putting a model into production that can go wrong really. Whereas with a traditional app, the thing is invariant given time. As time goes on, as long as expectations that you coded things, the inputs that you expect come in as expected, you don't have to update or change the app or the model, that's not necessarily true. "
13;Stefan Krawczyk;00:06:50.550;00:07:11.580;00:00:21.030;"Particularly since your model, if your inputs shift in inputs and values over time. Then maybe the internal state that you have in the model, actually becomes to be less relevant and actually starts output and change different results. Whereas in the other app, everything is pretty much hardcoded and it's very easy to reason about with the model, that's not quite the case."
14;Stefan Krawczyk;00:07:12.690;00:08:11.550;00:00:58.860;"It's usually happens that you're also updating models, probably far more often than you are updating that internal app logic. If you think of did that function endpoint and how many different versions there are, over the course of time. As you update the model, you have to get that update to the app somehow. How you do that in a way that doesn't break things. Once it's in there, how do you reason about, ensure that things aren't changing for the worse or if they're changing for the better. You need more measurement and observability around it. Then what happens in production, then also flows back to or so creating a better model. You have a loop, you should always be thinking about when you're deploying a model that there is going to be this feedback loop that you have to think about. Whereas with the traditional app, you can be one and done it and other than adding new features to the app, which is where DevOps practices really help, from that perspective but in terms of once you've created a feature, it's probably not going to change very much unless the business changes."
15;Stefan Krawczyk;00:08:12.060;00:08:16.640;00:00:04.580;"That changes on a much slower pace than on the pace of our model, as it evolves."
16;Simba Khadder;00:08:20.400;00:09:17.190;00:00:56.790;"My last company, we built a Iot of recommended systems which I'm sure you don't, but quite a bit, that's Stitch Fix. One of the problems that we always ran into is there's no such thing as like the perfect recommended system, and sometimes for example, la user would say, ""Oh, this user got a really bad recommendation."" It's like, ""Well, how do you fix that?"" One option is that you write if-statement, band-Aid on it, but other options, you try to retrain the model and fix that, but then it becomes Whac-A-Mole. You can't unit test it, because it's what the model has learned. We had to do all kinds of wild… There's a lot of stuff we built to make it possible and uses things that would never happen, like you said. Something that is much more the standard programming, if something is wrong, you can go and debug it. If a model is outputting garbage sometimes, what do you do? It's not really a good answer. You can retrain, you just try things and hope it fixes it or you really have to… there's no perfect way do it."
17;Simba Khadder;00:09:17.190;00:09:26.640;00:00:09.450;"You can't just go in and say, ""Hey, I'm going to change the sway to 1.7 and then it will all work out."" I think that's where a lot of these problems come into play."
18;Stefan Krawczyk;00:09:27.600;00:09:50.490;00:00:23.610;"The way that I think about it is that model is statistical, so there is rather than it being a binary outcome which traditional programming you do. With a model, there's a statistical set of outcomes. In which case, there are some areas where the results not that good and we're not going to know what to do here. Definitely brings some uncertainty into running a production service."
19;Simba Khadder;00:09:53.220;00:10:11.610;00:00:21.060;"We already talked about it but I want to bring it back to the forefront is, in the early days of MLOps, we didn't even call it MLOps. Nowadays, there's a whole set of startups, there's a whole space, there's all these categories that we've defined. How has MLOps changed over the years, from your perspective?"
20;Stefan Krawczyk;00:10:12.420;00:11:20.220;00:01:07.800;"Good question. I think back in the day, people were, such as myself, we were an embedded engineer in a team and we basically did things end to end. Then as companies start bringing ML, back then it was, you need a bit list, bit of a platform to centralize some of this costs. I think that's where the move to ML platform and building ML platforms. I think, Uber's Michelangelo, is a classic example of this. People realized that there's a whole ecosystem around it, you need to build a fully blown solution like Michelangelo to get any value. It's in the mindset and practice, therefore MLOps emerged. How has it changed? I think there's definitely more widespread adoption of machine learning and people realizing that they have similar problems. Then also, realizing that there isn't one solution that fits every single use case. AD surveying technology and machine learning models there is very different than predicting health outcomes. They have different velocities of model retraining and stuff like that. I think there's been a more emergence and acknowledgment from industry."
21;Stefan Krawczyk;00:11:20.520;00:12:11.100;00:00:50.580;"There are all these different problems, you can't build a single platform that will serve everyone. People have tried. I think those haven't been gone too well. There's also the people who are doing MLOps has changed over the years. I think it was very much CS heavy, computer science background. Now I think it's anyone who comes from the other end, who's coming from, ""Hey, I know how to build a model."" Say, applied physicist, statistician. How can I now think about deploying and pushing things to production? I think potentially less software engineering, classical training background people getting into things versus before. If you were a machine learning engineer, you're almost guaranteed to have a software engineering background. Now I don't think that's the case. That impacts the framing and who's using and the pitch and tooling from ops."
22;Simba Khadder;00:12:11.640;00:13:15.540;00:01:03.900;"I love the breakdown. There's almost three stages, that you mentioned. The stage one was MLOps wasn't a thing, you were just an engineer on a machine learning team or a team that happened to be doing machine learning and your goal was get this in production. Stage two was, we'll build a platform team that does this for all company and then stage three is, what we're at now or what we're getting into, which is, we don't really need to have a custom platform per company. A lot of these things look the same in different places, there's lots of nuance. We really need is almost like a set of tools, like DevOps tools, that we can bring in and configure to fit our workflow. It is interesting to compare DevOps to this because it's very similar. Stage one was, you have an engineer on the team and their goal was just get it into production somehow. We'll build it, that person's job is or maybe [inaudible 00:13:00] engineers, get in prod, make sure it doesn't go down. If it goes down, you get a [inaudible 00:13:04], you go figure it out. Stage two was let's go build our own DevOps platform like Google built Borg and there's all kinds of other examples of DevOps toolsets that are created."
23;Simba Khadder;00:13:15.540;00:13:37.170;00:00:21.630;"Now we're in that third stage, which is, we don't need to go and build Borg, Kubernetes exists, even all the hashwork tools exists, like CI/CD exists. There's all this Opera open source tooling that we can take up and bring together their workflow. It is bit of the same thing happening over again, but just applied for a different problem space."
24;Stefan Krawczyk;00:13:37.770;00:13:43.740;00:00:05.970;"Yeah, totally. I think it says something about the maturity of how solutions permeate through industry."
25;Simba Khadder;00:13:44.490;00:13:52.140;00:00:08.400;"With all the changes that are happening, how do you, yourself keep up with everything? It feels like there's a new blogpost, new something every single day."
26;Stefan Krawczyk;00:13:52.440;00:15:01.060;00:01:08.620;"Yeah. It can be overwhelming. I think my go-to is generally Twitter. The way I discover things is, Twitter is one way, there's is engineering blogs from tech companies. There's a rise of Substack and all the various newsletters. I subscribe to bunch of them that I thought were interesting. What I end up doing is, skimming headlines and then bookmarking things later that I want to read. The best methodologies are things that get the most buzz generally in your eye. I probably [inaudible 00:14:22] because of the way I look at things, but otherwise it's useful from the things that I have bookmarked, is trying to get an understanding for the mindset of, why was this thing created? Because to the point where there isn't one solution that fits all. People create solutions for different reasons. I think it's useful to vicariously live through those posts and things, and try to understand why it was created in the first place. Was it an organizational thing that led to this particular solution versus then building another one? That's an interesting question to ask sometimes with these decisions, because it's not true with MLOps that every company has the same topology, in which case like different solutions, you might be selling to different people."
27;Stefan Krawczyk;00:15:01.080;00:15:21.690;00:00:20.610;"Should I build this is [inaudible 00:15:02] it really depends on your company topology. At least from staying up to date, I try to step back and ask question, why was it created and what was the environment that created it? Maybe there's something to that, smaller companies do this or big companies, they have these problems. That's at least way that I… things I love to take away from reading posts and things."
28;Simba Khadder;00:15:21.960;00:15:31.350;00:00:09.390;"Can you name drop a few people, that people should follow or some Substacks you like or anything. Just to name a couple, for people listening who want to at least get started."
29;Stefan Krawczyk;00:15:32.700;00:16:35.130;00:01:04.560;"Your mileage may vary. I'm terrible at remembering names. I just know that it comes in my inbox. The last one that I remember reading was TheSequence on Substack. Otherwise, on Twitter I follow Sarah from Amplify Partners. Tweets and data ecosystem, ML ecosystem there. I think if you know of any of the open source projects, follow their Twitter handles, maybe follow some of the core contributors on them, you'll get to see updates. Maybe they they'll go to a conference or something and then you can pick things up that way. I have Josh Wells from the data engineering side. I follow the ML, AI gurus Andrew Wing, Andrej Karpathy. I try to hit people from the various big tech companies, there is Sebastián Ramírez from FastAPI, since I've been living in a Python based world or focus on Python based things and so following a bunch of those people there. Try to follow some people from DevOps side, MLOps side. You can follow me or you, Simba. From the actual machine learning infrastructure, I'm like where industry and interesting things that are happening, follow AI, ML research people."
30;Simba Khadder;00:16:37.620;00:17:08.280;00:00:31.170;"Everyone should probably follow a mix of each section, you need to understand what's happening in AI [inaudible 00:16:41] MLOps specifically, from practitioners. You're going to need to cast a wide net to make sure you catch the things that matter. There's a lot of noise and there's just a lot of things being figured out. It's almost like trying to keep up on papers, you just can't. You just have to find a way to figure out what is and isn't worth keeping up with. You have a class coming out [inaudible 00:17:04] on August 22nd. Can you share some more about it?"
31;Stefan Krawczyk;00:17:08.640;00:18:27.570;00:01:18.929;"Yeah, I'm partnering with Sphere. They're their recent yc batch company and it's called Mastering Model of Deployment and Inference. The idea is an executive Ed style class for practitioners. There's four two hour sessions. The goal is to try to give people the skill set and ability or at least the know how to improve latency and throughput by thinking about like how do you select appropriate inference architectures, how do you reduce outages or the mean-time to resolution? How do you do that? What are some common model observability approaches to do so? What's the overall macro-architecture and what is the impact of your machine learning architecture with respect to reliability, scalability and getting models to production? If you think about it, you're thinking about questions such as, what components should my model deployment system have? Where will my current approach to deployment inference break down? It isn't going to be all lecture based. It's going to be me lecturing a little bit, but then it's going to be some group work or a group discussion. Hopefully there'll be some other machine learning engineers or people who deploy stuff to production so that there'll be some interesting networking, could also be some interesting questions asked, I have this problem, et cetera, so you can maybe let your classmates. Hopefully by the end of the class, learners, you'll be able to answer questions that something like the following: What are the components that my model deployment system should have?"
32;Stefan Krawczyk;00:18:27.810;00:19:15.240;00:00:47.430;"I think it's an interesting one. Not everyone needs every single component because I don't think it really depends on your SLA and what's the cost of an outage. Our discussion is to, what components should you have? Then maybe even helping you take a critical look at, what is my current approach to deployment and inference and where is it going to break down? What is going to be painful for the business or for me and then what do I want to do about it? What are some architectural pressures or changes that I could pattern that I could use to help make a decision? What are some architectures/patterns or tools that can help me reduce my outages or my mean-time to resolution? A class that try to pack in a lot in four sessions but the idea is that it's framework agnostic and that you can try to take away some general mindset thinking and patterns that you can apply to your particular context."
33;Simba Khadder;00:19:16.020;00:19:30.210;00:00:14.940;"We'll have a link at the bottom. If you want to check it out and if someone checks it out, you'll be able to learn more there. Let's talk about Stitch Fix. You built out a lot of the ML infrastructure there. Maybe you could share, how did the workflow look like a Stitch Fix?"
34;Stefan Krawczyk;00:19:30.360;00:20:34.440;00:01:04.080;"You don't know, Stitch Fix has 100 plus data scientists which… It's role was to iterate prototype production [inaudible 00:19:38] be on call for models. We're trying to build tooling and abstractions to enable them to software engineering [inaudible 00:19:44], pull things off the shelf and create their workflow and getting things to production without software engineering [inaudible 00:19:50] rather than them having to engineer things themselves. That's the mindset and the thing that we're going for. We were always competing with people doing things themselves. In which case, the task of my team was to like build better tooling and get people to adopt our stuff. By the end of it, we were working on a way to a YAML config in Python code driven way to creating machine learning pipelines. The idea was to how do you enable people to more easily manage and create pipelines because that was bit of a problem. It's districts where everyone wrote their machine learning pipelines in different ways. How do you standardize that? The idea was, if we can get people to write these configs that then would, under the hood, essentially compile down to airflow jobs."
35;Stefan Krawczyk;00:20:34.710;00:21:32.010;00:00:57.300;"How do we build this API layer, that we're not leaking if we're not leaking too much of the context but we're standardizing and trying to simplify how people specify things in a way that helps ensure that things aren't too coupled, so that if they want to reuse something or change something, it's not going to be a lot of pain and effort to do something. That was then all built on top of a little framework we called the Model Envelope. It was like our ML flow model, ModelDB analogous type of technology. With the model envelope as the metaphor, I'm trying to suggest is, you have a model and an envelope and then you're shoving things, not only about the model but things about it into it. Then we're packaging up in an envelope so that we could then use it in various contexts without you having to write any code to do so. It's just tricks, you could write a model, save it and then you could have it deployed into production in under an hour because we could auto generate the web service code for you. Getting to production was, at least a model to production, was pretty easy."
