Number;Speaker;Start time;End time;Duration;Text
36;Stefan Krawczyk;00:21:32.280;00:21:59.450;00:00:27.170;"Getting features to production that was a little harder, just to implement things potentially at two places or we're trying to fix that, move on that to try to make it only one. Then we're also trying to simplify the management of model pipelines. Since over time, as the team grows, you generally inherit and have more machine learning models or more pipelines that grow. How do you manage that? That's where that effort was going, to help teams not have to incur tech tag by relying on a platform less so there on code."
37;Simba Khadder;00:21:59.820;00:22:15.500;00:00:16.030;"A lot of it was standardizing, once you have the weights, the model itself, it's standardizing everything around it. How is it deployed? Was it need this input all that and making it so that with this, once you fill these configuration files for me like I'll make it so in production."
38;Stefan Krawczyk;00:22:15.630;00:23:22.530;00:01:06.900;"Yeah. The Model Envelope was, you can say, independent from the system for defining your model training pipelines but essentially, yeah. With the DevOps and MLOps mindset, we're trying to put in the hooks and things such that people didn't have to make different decisions on how do you log things in a web service? We just kind to standardize it by actually saying, ""We'll just generate the web service for you."" ""What are the things that we should save about the model?"" Hence, we introspected the Python environment to make sure that we capture the Python dependencies exactly as what they were so that we could one, always reproduce the model but then to have a have a pretty good idea of what's required to run it in production. Then with the system to simplify model training and model training pipelines, it was around a lot of people, role model training code that was highly coupled to their context and it was very hard to share that. How do you do that? You needed to couple how you provide inputs into the model training process, in which case it was lsoftware abstraction was config to split the two apart of like how you create and featurize data and provide its training and make the training the process of creating a model pretty standardized in a way that is agnostic of how data gets to it."
39;Simba Khadder;00:23:22.560;00:23:32.670;00:00:10.530;"What's a design decision that you made in building this that perhaps someone listening is building like a model surveying or a similar thing, what's something you decided that you can maybe share, that worked really well."
40;Stefan Krawczyk;00:23:33.090;00:24:39.110;00:01:06.020;"I think the easiest is to probably talk about the Model Envelope. One of the ideas was, we don't have an API that someone triggers to deploy a model at the end of their pipeline. If you look at a bunch of these frameworks, you save the model, but then somewhere along the lines, you say deploy model step. We explicitly made a decision to not have that and instead people then need to go to a web service UI and write a little set of rules that would trigger deployment. That was so that was very easy for us to then insert and stick in a CI/CD step such that we could enforce one. For anyone who wanted to deploy something, we could make it very easy for someone to like, ""Oh, you want to deploy this model? Okay, well, maybe you're on the point of staging first."" Do some things with staging, say that it's good and then we'll kick off a production deployment. Whereas if we had allowed people to stick in deploy model at the end of the script, we wouldn't have had as much control with respect to inserting and upgrading and changing how models are deployed so we made a very explicit decision that, you can't trigger deployment programmatically, you need to do it through our service, which where you set up a SM rules."
41;Stefan Krawczyk;00:24:39.120;00:24:55.680;00:00:16.560;"[inaudible 00:24:41] worked really well for us. We were able to ensure that if we wanted to change how things are deployed or how things are triggered, we only had to change our service. We didn't have to change anyone else's pipelines or code or anything. That was one very explicit decision we made."
42;Simba Khadder;00:24:55.800;00:25:23.310;00:00:27.510;"That's fascinating. That's a very interesting decision. I feel like that can apply in a lot of different places. A lot MLOps [inaudible 00:25:01] anything, You say send, there say deploy and making it so that you almost can't do that. It has to be integrated into [inaudible 00:25:10] system, very opinionated. Yeah, it's fascinating. I also want to talk about another big project that obviously you've shared a lot about is, Hamilton. Maybe you could share more. For those who don't know, what is Hamilton and how does it fit into the system?"
43;Stefan Krawczyk;00:25:23.700;00:26:18.210;00:00:54.870;"Hamilton is a declarative dataflow paradigm in Python. What do I mean by that? It's declarative in that as you're writing code, you're declaring an output and then you're declaring more inputs. You're not writing procedural code when you're writing dataflow. What's a dataflow? Dataflow is basically an academic term for basically modeling, how data and computation flow. You can think of an analogous to workflow, a pipeline. You're basically building a workflow or a pipeline. Hamilton, where it fits in and where it came from was, it was actually one of our earlier projects that we did, and it was to help the team who was doing time series feature engineering and the code base. It was like one of the oldest teams with Stitch Fix. They were a team that I created, operational forecast for the business, that business made decisions on. They were always under the gun to like produce numbers or forecasts so that the business can make decisions. In which case, they're not a team that had time to address tech tag or anything like that."
44;Stefan Krawczyk;00:26:19.140;00:27:24.630;00:01:05.490;"Essentially, they were in such a state that their feature engineering code was spaghetti code. That's partly because with time series feature engineering, you are creating a lot of features. You basically think of a data frame or data frame that you're going to be training or fitting a model on. It's thousands of columns wide. It's not necessarily big data, but it's very wide and it's very wide because of the feature during process, because you're usually deriving features from other features. You're basically chaining features together to create other features. If you do it in a procedural way, once you get to a certain scale, your code can very easily devolve into spaghetti code, especially if you're using pandas. Hamilton was built to try to mitigate and ensure that things are [inaudible 00:26:57], they're documentation friendly, and can help them with their workflow, creating features and generating this featurized data frame. Back to Hamilton, so rather than writing procedural code, we're doing column C equals column A plus column B, you would rewrite that as a function where the function name is C or column C and then the function inputs, the input arguments, column A and column B, and then you'd have your logic to some column A, and B. "
45;Stefan Krawczyk;00:27:24.630;00:28:29.220;00:01:04.590;"You could use the function docstring document. Anywhere that you basically have assignments, you're rewriting in a script, you're rewriting it into a function, and then you then have to write a little more… we got a little driver script, but the driver scripts purpose is to basically stitch together these functions because the function name declares an output, if you want to create, actually create column C or use column C and some other thing, you write all these functions. We then crawl the python codes to pass some code in this, what we call driver object to create a directed acyclic graph. Basically it's a dependency chain of, if I want to compute column C, I know I need A and B as input. A and B can either be defined as either functions, you would look for a function name with a column A, column B, that would be provided as inputs. Hamilton decouples the modeling of the dataflow with the pipeline from materialization. You're running these declarative functions that declare a workflow or a pipeline or a dataset, of how data [inaudible 00:28:21]. Then you're writing this driver script that's actually defining the dag, and that's where you are providing configuration and inputs."
46;Stefan Krawczyk;00:28:29.220;00:29:21.510;00:00:52.290;"At the end you're specifying what you want computed. Now with Hamilton, you can specify or rather you can model a superset of transforms and things and only in the driver you only have to request the things that you need because we have a DAG or directed acyclic graph, we can walk the graph in a way that we only compute what we need. This means you can test integration tests things very easily. You don't have to have a monolithic script where it's like if you add something, you need to run everything to test something. No, with Hamilton it's very easy to just test that one thing you add into end. It's also very easy to see unit test because you write everything as functions. Those functions, you're not leaking how data gets into it. It's very easy to to writing a unit test that passes in the right data to exercise the logic. That's been running a production [inaudible 00:29:12] for over two and a half years. Since then, we open-sourced in October. We're now adding a few more things to it. If you want to scale on to [inaudible 00:29:19], it's very easy to do so."
47;Stefan Krawczyk;00:29:21.510;00:29:58.500;00:00:36.990;"You don't have to do anything. You just have to change some driver code. We recently just added some basic ability to do some runtime data quality checks. Common complaint was, ""Hey, my problems are running. I think the code looks good, but the output is crap. What's going on."" Right now with Hamilton, it's very easy to set with the function just above it, with a decorator, you can set some expectations such that when things run execution time, we can run a quick check to ensure [inaudible 00:29:46] types are there. There are no NaNs or if there should be less than 5% of NaNs and things like that. I think Hamilton right now is a pretty interesting tool for anyone doing any feature engineering, and especially if you're doing a time series feature engineering."
48;Simba Khadder;00:30:00.300;00:31:02.630;00:01:02.330;"One thing is based off of listening to a lot of what you've been saying that I can have a very similar opinion as you is, most of MLOps problems are abstraction problems. While people treat them like infrastructure problems. The hard problem, in MLOps, in my opinion, is getting the right abstraction in the workflow to… You have to be [inaudible 00:30:18] in some places and very configurable numbers. You have to be like, ""Hey, you need to do things this way, that's only keeping this version, organized, testable, et cetera."" In other places, if you want to use, like in your example, [inaudible 00:30:31] MLOps like this. Do whatever you want. Train, use if you want to use tensorflow, you want to use PyTorch, we don't really care because that's where every needs data science is. What we care about is all the coordination and metadata that comes in to allow you to do that without having to like mainly say, ""this is this and it goes here."" We have to set some parameters, some framework so that you follow this framework, it's implied where it will go, what version it is, what the name is, all this other stuff that you want in MLOps pipeline."
49;Stefan Krawczyk;00:31:02.990;00:31:44.330;00:00:41.340;"Yeah, totally. To preventing bad things from happening in production, you really need all that extra metadata. With the abstraction is, how do you get people to do it? It's either procedurally you have to add things in, which in case people forget or they don't do it at all because it's extra work. Then how do you do it in a way that can pull out of things automatically? Part of the theme of my team in Stitch Fix was, how can we do that in a way that people just don't have to think about it and it's the right way to do it. Hamilton is in bit of this theme as well. You right functions out, they're automatically unit testable just by design. You don't have to think about it later. Definitely it's an abstraction problem if you want to do MLOps well."
50;Simba Khadder;00:31:45.530;00:31:53.960;00:00:09.630;"We have talked about so much different aspects of MLOps from surveying to data pipelines to how it's changed over the years. What's something you're most excited about in a MLOps space right now?"
51;Stefan Krawczyk;00:31:55.820;00:32:53.540;00:00:57.720;"That's a good question. I think there's so many open source tools, there's also so many startups and companies trying to do something in space, if I was a practitioner and I like to build models, I'd be excited because it's never been easier to get something up and running without you having to build all of it yourself. One of the things that I'm looking to is, how does low-code solutions impact MLOps and how much code are people actually going to be writing to get most production? Is it going to be config based stuff? Is it going to be integrated to a SQL? You see companies, guys out of Uber, I think Ludwig [inaudible 00:32:32] they're trying to use SQL like syntax to help people do models and do modeling. There's a bunch of companies like that and there's companies that are trying to appeal to more people who want to write a little bit more code. To me, it's exciting to see all these different approaches emerge, and I'm wondering who's going to win? Which one is going to actually ultimately win out?"
52;Stefan Krawczyk;00:32:53.840;00:33:12.470;00:00:18.630;"I wouldn't be surprised if everyone wins because there is so many ways and so many different companies that have machine learning about a structure and function differently in different SLAs, in which case it could be a win for all of them but otherwise, just the Cambrian explosion, you could say, of MLOps tools. I'm excited to see how things evolve as to what eventually dies off and what actually sticks."
53;Simba Khadder;00:33:12.990;00:33:25.370;00:00:12.900;"I love that. I think there's so much more we could cover, but we do have to eventually wrap up. I would love to like you're almost like a TL;DR. What is a tweet length takeaway that someone listening to this podcast should leave with?"
54;Stefan Krawczyk;00:33:26.120;00:33:58.670;00:00:33.210;"Use Hamilton, take my course, right? No. The tweet length takeaway is I think understanding the environment on which you operate based on a tweet… that's not a tweet length. You should understand the impact on the cost of what you want to prevent. I think it's probably maybe one way to frame what we've been talking about. MLOps is very specific to our environment. You want to prevent bad things from happening and so therefore the solutions that you want to implement, I think are related to your environment and what the cost is of bad things happening. You should understand the impact of costs, what you want to prevent."
55;Simba Khadder;00:33:59.030;00:34:02.570;00:00:03.540;"I love that. Thanks so much for hopping on, Stefan. This has been such a cool conversation. Thanks so much."
56;Stefan Krawczyk;00:34:02.780;00:34:03.260;00:00:00.480;"Thanks for having me, Simba."
