Number;Speaker;Start time;End time;Duration;Text
0;Simba Khadder;00:00:03.320;00:00:24.380;00:00:21.060;"Hey, everyone, my name is Simba Khadder, and you're listening to the MLOps Weekly Podcast. Today, I'm really excited to be speaking with Jacopo Tagliabue. He's most popular in MLOps community for his GitHub repository, You Don't Need a Bigger Boat, and a lot of his content about ML at reasonable scale."
1;Simba Khadder;00:00:24.380;00:00:46.390;00:00:22.010;"Most of his career was as a data scientist across a variety of different organisations before he started his company Tooso, which was Search-as-a-Service. He acted as CTO and took it all the way to acquisition by Coveo, where he was most recently the Director of AI. As of now, sounds like he's onto his next thing, which I'm sure he'll be sharing more about soon. Jacopo, so great to have you on the show today."
2;Jacopo Tagliabue;00:00:46.390;00:00:49.550;00:00:03.160;"Thanks so much for having me, and thanks for everybody to join us."
3;Simba Khadder;00:00:49.550;00:00:55.070;00:00:05.520;"I'd love to get it from your perspective and your words. What got you into ML, what was your journey like to get here?"
4;Jacopo Tagliabue;00:00:55.310;00:01:11.250;00:00:16.180;"The journey to modern MLOps was basically the realization of sucking in the entire tool chain by myself in the old MLOps world, when there was not even MLOps as a word. If you remember my story, I used to be the CTO and Founder of a startup in Silicon Valley."
5;Jacopo Tagliabue;00:01:11.250;00:01:28.440;00:00:17.190;"It was doing NLP for e-commerce, which is an interesting case for ML. It's high value, both in terms of business and financial outcome. But it's also high volume, and it's something that is very crucial for an e-commerce shop. You can't really run an e-commerce shop without recommendation or without intelligent search."
6;Jacopo Tagliabue;00:01:28.440;00:01:47.700;00:00:19.260;"Things need to be up all the time and the model needs to produce the outcome that you expect the model to do. All the problems that you now see today in monitoring or reproducibility and so on and so forth, but of course, part of what we had to tackle in 2017, when we had to build our entire infrastructure without any of the tool that is now today."
7;Jacopo Tagliabue;00:01:47.700;00:01:58.940;00:00:11.240;"That's why I'm saying I almost suck at any point in time, in any of the part that comprises a modern data and ML pipeline. The digestion, transformation, training, survey, monitoring."
8;Jacopo Tagliabue;00:01:58.940;00:02:18.390;00:00:19.450;"Last year, I think, last year or something like that, I went back to all the choices that we made building Tooso, during my tenure at Coveo, and we asked, ""What if we build something like that now with all these tools? What will we keep?"" And guess what, it's nothing. We're to build basically completely different toolchain, a completely different set of tools and capabilities."
9;Jacopo Tagliabue;00:02:18.390;00:02:40.580;00:00:22.190;"Then we open source that in the famous You Don't Need a Bigger Boat repo for everybody to use it, which is the idea of this blueprint of an ideal AI company that basically produce backend for models. And the realization that what took people and months five years ago, now it can take literally one person and days to achieve the same level of capabilities."
10;Jacopo Tagliabue;00:02:40.580;00:02:46.580;00:00:06.000;"So I can't be more thrilled to live in this time and age when I don't have to suck anymore, and all of the things that I used to suck at before."
11;Simba Khadder;00:02:46.770;00:02:58.690;00:00:11.920;"It's so funny to look at... I actually have a very similar story to you. I actually built Featureform, and my last company, we were also doing 10 recommendations as a service more and we were handling like 100 million MOU."
12;Simba Khadder;00:02:58.690;00:03:19.150;00:00:20.460;"We had something called our data platform, that we built, but nowadays it's a feature store. And MLOps wasn't MLOps. We didn't really have a word for it, it was just like our workflow I guess. We built everything. There was nothing out there. There wasn't really even examples, like a list of DevOps. You could look at Google and be like, ""Oh, well, that's the gold standard."" I never really felt that we had that."
13;Simba Khadder;00:03:19.350;00:03:32.950;00:00:13.600;"That repo you mentioned, You Don't Need a Bigger Boat, obviously, if you haven't seen it, if you're listening and you haven't seen it, you should go see it, it's awesome. For those who haven't seen it, could you dive into it? What does that stack look like. What did you figure out looking back and doing that analysis?"
14;Jacopo Tagliabue;00:03:33.150;00:03:45.630;00:00:12.480;"Sure. I think there's a bunch of things that... If you're trying to do an MLOps stack nowadays, there is a bunch of things that are somehow fundamental. As in, without those things you can't even say that you have an ML pipeline."
15;Jacopo Tagliabue;00:03:46.590;00:03:57.810;00:00:11.220;"The first thing for us, I think for everybody is data, because data is in the end of the day most important part and where the biggest margin of value is. How you store data, how you query data, you normalize data, that's a very important part."
16;Jacopo Tagliabue;00:03:57.810;00:04:09.840;00:00:12.030;"The second part is training. Of course, you know, once you have data, you have to train a model to do whatever you're doing. If you're not training, you're not doing ML. That doesn't mean there's no value, but you're just doing maybe deterministic stuff for rule base and so on. With a different set of problems."
17;Jacopo Tagliabue;00:04:09.840;00:04:22.590;00:00:12.750;"Then finally, serving. It may mean different thing to different people, depending if you're doing offline influence, online influence on. But at the end of the day, if you train a model, the model stays on your laptop or even on your cloud, it doesn't make any impact on reality."
18;Jacopo Tagliabue;00:04:22.710;00:04:35.620;00:00:13.030;"There must be a way after training, for your model to make prediction, again in different ways. So you have to figure out at least three basic minimal pieces to call yourself an ML engineer. You have to say that you have a pipeline in at least after the pieces."
19;Jacopo Tagliabue;00:04:35.780;00:04:53.440;00:00:17.820;"So for us, going back to our previous experience, we replaced the entire EMR Spark S3 querying base that were with Tooso, with Snowflake. Snowflake wiped out the entire infrastructure and clunky things that we had to maintain in this part time."
20;Jacopo Tagliabue;00:04:53.560;00:05:05.600;00:00:12.160;"Snowflake just gives you this nice thing when you just store all the data you want, you run a SQL query. You don't really need to know how that is distributed, that is executed. You just get the result back and it's awesome. That was point number one."
21;Jacopo Tagliabue;00:05:05.600;00:05:27.590;00:00:21.990;"Point number two for training for us was moving from clunky script-based approach to Metaflow. Metaflow is our open source tool. Everybody can use it, it's completely free of charge. It was open-source by Netflix and it's now maintained by a company called Outerbounds. And for us, it was a way to enforce good practices in how you structure your training code to replace undeveloped experience."
22;Jacopo Tagliabue;00:05:27.930;00:05:42.730;00:00:15.040;"Metaflow by being so pleasant to use invite you to do the right thing and discourage you from doing the wrong thing. Automatically makes your team works a bit better. Now you train, you experiment and now you run all this fast iteration. That's point number two."
23;Jacopo Tagliabue;00:05:42.970;00:05:59.660;00:00:16.810;"Point number three, which is the one that I feel for us, there's still more work to do on the serving side, that really depends on the use case. Some other use cases are relatively simple in the sense that you can do batch prediction. So you don't really need to have the model that you train live in some sense."
24;Jacopo Tagliabue;00:05:59.660;00:06:14.770;00:00:15.110;"You can just run prediction against the model while you're still in the batch mode, and then you can store them in DynamoDB and serve them through the cache in real time. It's very easy, but it's very powerful because now thanks to DynamoDB, Serverless and so on, you can do that without maintenance, so that's awesome."
25;Jacopo Tagliabue;00:06:14.770;00:06:37.260;00:00:22.490;"Then some other models are actually online models, meaning that there's a prediction that is made at runtime. And for that, there's a bunch of solution up there that we explore from the easiest one, say on the SageMaker side to the more complex one now we're working with a company called Exafunction to do more complex stuff, and with other things in between, like try it on [inaudible 00:06:34] and so on and so forth. So that would be the third pieces."
26;Jacopo Tagliabue;00:06:37.260;00:07:06.560;00:00:29.300;"Once you figure out all the three pieces go together, now you can add all the sorts of fancy stuff that you want. And if you go to the big [inaudible 00:06:43] repo, you're going to see different options for orchestrating this. You're going to see different option for experiment tracking. You're going to see monitoring solution and so on and so forth. But all of that comes into place once you have the first end-to-end version from raw data to prediction, figure it out. Because if you try to do more complex thing until you figure out the first end-to-end thing, you just going to make your life more complex without a necessary pickup side."
27;Simba Khadder;00:07:06.760;00:07:48.370;00:00:41.810;"I want to jump into the explosion of MLOps tooling. One thing you've said, which I totally agree with is, the goal, especially if you're a startup, is simplicity. You don't want all these moving pieces because it's your job to maintain them. So you want to go things that are hard to use wrong, like, we just work. Last thing you mentioned that Snowflake wouldn't really call them MLOps companies. Now there's been an explosion, all the MLOPs tooling. Well, my first question about it is, it happened about three years ago. It's at least this new wave of MLOps startups came to be. You had that problem years before that, and so we had to do our own stuff. What do you think happened? Why did it start three years ago?"
28;Jacopo Tagliabue;00:07:48.570;00:08:13.690;00:00:25.320;"There's a bunch of things. First, I think the basal practitioners, they used to run ML, they become much broader and went out from the few companies that already know what they're doing. I have friends at fancy companies like Facebook, Google and so on and so forth, and nobody ever complained that they cannot put a model in production. None of my friend ever said any of these sentence. There's a lot of other problems but not this one."
29;Jacopo Tagliabue;00:08:13.690;00:08:28.130;00:00:14.440;"And then if you go and look at the usual Garda report that everybody cites or most of my Linkedin feed, it's about people complaining 80% of the product or the other project don't make into production or something like that. So there must be something that these people figured out that everybody else didn't, by definition."
30;Jacopo Tagliabue;00:08:28.630;00:09:04.420;00:00:35.790;"I think the market got to be bigger because a lot of people that are not necessarily at Facebook scale like Coveo, or Tooso, my company, but are sophisticated enough to now need to run ML for the sake of their business, but they're are limited resources or scale of big tech and so there's more appetite for tools that automate some of the things that are not my core businesses, and I don't want to maintain, but they're still necessary for me to do my job. The more AI companies there are out there, the more practitioner need to focus on AI creating value, not so much on maintaining AI stack. And I think that's a huge shift in demand in that [inaudible 00:09:03] sense."
31;Jacopo Tagliabue;00:09:04.420;00:09:45.820;00:00:41.400;"On the supply side, we live in, especially in the valley, through cycle of excitement and disillusion in many things. And I think there's been a lot of excitement in the VC market. For ML and data companies in the last couple of years, we've seen very good rounds, very good valuations and so on and so forth. So obviously, the field is very optimistic about the fact that this market is going to get bigger and bigger. And so also on the supply side there has been a disproportionate amount of money at disposal for people that wanted to build companies and they wanted to solve this problem. So I guess these two things together conspired to create this perfect wave when now there's like a million tools for ML, MLOps, StatOps and so on and so forth. Makes it a very interesting time to be in the space."
32;Simba Khadder;00:09:45.980;00:10:22.060;00:00:36.080;"How do you think that will evolve? As in maybe one specific question; there's a lot of companies that aim to be best-in-class categories, solutions. There are companies that aim to be full stack MLOps. There are a lot of people in the middle. It feels like there are some established categories like feature stores. There's a lot of companies that feature service as companies and monitoring. And then there's new companies that almost evade categories. You can't even really pump them into something, just different takes. What do you think the future looks like? Do you think that there will be consolidation to MLOps platforms? Do you think it will be a lot best-in-class tools?"
33;Jacopo Tagliabue;00:10:22.060;00:10:49.460;00:00:27.400;"That's a very good question. And the answer is, of course, I don't know. Prediction is very hard, especially about the future, like the guy used to say. But the general guess is, it seems to be there's a lot of company right now and especially in some sectors, a lot of competition and not a lot of differentiation. So there are entire sector in which is very hard. There's a lot of good tools. But now they're all very similar to each other. So it's very hard for somebody to come in with a fresh perspective."
34;Jacopo Tagliabue;00:10:49.460;00:11:21.710;00:00:32.250;"These are people that are trying to inject that fresh perspective, as you said, by expanding into more part of the MLOps tool chain. So they're trying to go...Maybe they started with this specific problem, but now they trying to lure you in on other side. But that's a risk, that's a tradeoff you're trying to make. As in, if you're trying to do more than one thing, you may not be the best-in-class in all of this thing, of course. And then there's an argument to be made that a sophisticated practitioner will just pick and choose the best tool and just orchestrate themselves. Which got the lessons of the bigger bot repo. Which again is already a year old. Let's remember this. It's already a year old."
35;Jacopo Tagliabue;00:11:21.710;00:11:32.180;00:00:10.470;"But at that moment in time, I felt that the best practitioner will pick and choose from SaaS and open source and put them all together. Which doesn't mean it's going to be the same answer in two years from now."
36;Jacopo Tagliabue;00:11:32.180;00:11:52.680;00:00:20.500;"I will be very skeptical of the entire end-to-end platforms because I think ML workload superficially looks similar. But then at the end of the day the devil's in the detail. So there's a lot of difference between different companies and how they implement that. And sometimes end-to-end platform feels like constraining people to work in one way instead of actually being a platform where people can be whatever they want."
37;Jacopo Tagliabue;00:11:53.000;00:12:12.050;00:00:19.370;"I'm not a huge fan of the ""Hey, this is a tool, you have to do everything in it, from training, testing, deploying and all that matter, whatever. I'm not a huge fan for that as a person. But also, I understand I'm more on the sophisticated spectrum of the practitioners. I also have very opinionative view of how things work and a lot of experience, like how to combine different things. That will be my take."
38;Jacopo Tagliabue;00:12:12.050;00:12:27.920;00:00:15.870;"Some consolidation, of course, I'm not sure if there's going to be the platform that ends it all. I'm not sure if there's the equivalent of Snowflake, my point for the entire MLOps thing. Because while all SQL queries look the same to a certain extent, a lot of MLOps company, actually, when you go under the hood, they look very different."
39;Simba Khadder;00:12:27.920;00:12:46.580;00:00:18.660;"One comment I got from one of our advisors was, as a tech company as Devto company, you sell one of two things. You either sell technology or you sell workflow. If you were selling a technology, it's just like, Yeah, I can do this thing that everyone else does, but better, like Snowflake. It's SQL, but it's better than all other SQL databases because of all these things."
40;Simba Khadder;00:12:47.490;00:13:16.880;00:00:29.950;"Then there's a workflow, which is, hey, what we built, it's not necessarily technically hard, it's just building the right API and choosing the right API. I use Terraform as an example here. Terraform is not easy to build. It's a hard thing to build. But in terms of what they did that I think was the hardest was the right API and the right interface to solve the problem at hand. And I think most MLOps companies are more the latter. They're workflow problem solvers and they're not technology solvers."
41;Jacopo Tagliabue;00:13:17.030;00:13:44.360;00:00:27.330;"I totally agree with that. I think it's a fantastic example with HashiCorp success. I think that that's a really good point. The analogy somehow break down, as in infrastructure is a very broad thing. The market is gigantic. Everybody's infrastructure. And again, a lot of infrastructure pieces tends to be the same across different companies. They do many different things. ML, unfortunately, is not the same. Even two people doing classification with deep learning-let's even be more specific-but then these two things may actually look completely different."
42;Jacopo Tagliabue;00:13:44.360;00:14:13.550;00:00:29.190;"Because the truth of the matter, the few people, I think, understand outside of ML is that there's no such thing as the ML that solves all the problem. ML that works a very specific thing, tuned to a very specific problem in a very specific way. That's the only ML that really realistically works. Which means that you need to go deeper into the type of problem...There's a coupling between your ML and your problem, way more than is between your infrastructure and your problem, which makes it hard to build this all-encompassing platform at the scale of HashiCorp, reached in some sense."
43;Jacopo Tagliabue;00:14:13.550;00:14:41.250;00:00:27.700;"Of course, everybody bets that this market is going to grow. I'm one to bet for sure on that. If the market becomes better, I've invested in it as a practitioner to be here because I'm going to be, again, remember, all of this started because I suck at thing. So the more people build stuff for me, the better I am. But I think there's a distinction between ML companies generally and InfraDev and data companies that somehow gets underestimated even by VC or clients or casual observers of people that never built a model themselves. Basically."
44;Simba Khadder;00:14:41.250;00:15:15.890;00:00:34.640;"I totally agree with that. I come from a recommender system background. And the way we did things and the problems that we have are completely different from people of computer vision backgrounds and people who do like [inaudible 00:14:51]. Also difference between we work with big enterprise company teams, we work with very small teams and the way they think, the way they problem solve, what they care about is just completely different. I think that those distinctions are often ignored. This computer vision versus not computer vision is a great example. The way you do computer vision, the problems to be solved, they're just so different."
45;Simba Khadder;00:15:16.170;00:15:39.270;00:00:23.380;"In modern pure vision, feature engineering isn't as much of a thing as it used to be. Whereas if you look at tabular data or recommender systems, it's all feature engineering. That's where all our value came from. I think that's something that's really, really crucial. When you think of your repo, do you create that distinction or do you think about the distinction or do you think that the blueprint you have works across computer vision recommender systems, et cetera?"
46;Jacopo Tagliabue;00:15:39.270;00:15:56.890;00:00:17.620;"The point about the repo is like, hey, this works for us and this is a use case that you can use. There are two use cases there. There's a bunch of other new open source repo, for example, one just for recommendation. There's a bunch of other repos that are tackling different use cases. There are a variation on the original blueprint. Probably they're better for the iteration."
47;Jacopo Tagliabue;00:15:56.890;00:16:22.280;00:00:25.390;"But the idea is that the original one ships with two problems. One is a classification problem. I give you a sequence of event, you need to tell me if it's going to be a conversion event or not. Imagine this a shopping example. So people are browsing on your web website. You need to guess, is this person going to buy at the end or not? And that's one problem. And the other problem is actually sequential recommendation. So it's like, the user's interacting with third products, where it's like YouTube like next or something like that."
48;Jacopo Tagliabue;00:16:22.380;00:16:48.950;00:00:26.570;"The thing that we say in the repo is, this is going to likely be the end of your story MLOps is. We're not pretending to end it all or to give you on a silver plate, your company. But this is probably a good place to start. If you have a problem that resembles these two problems or is actually one of these two problem, the pieces that we put in place for you to start are going to be okay. If you start with this, they're tested, they're okay, you can try them on, they're all open source. We actually open source all the data."
49;Jacopo Tagliabue;00:16:48.950;00:17:20.000;00:00:31.050;"So if you want to run the exact project that we did, we open source millions of event of shoppers that you can actually use to get the feeling about these scales, a different level of that load, for example. And once you're happy with that, you can make all the changes you want. We think of the repo as the place to start, not the place to end your journey. But at least you start instead of going on reading towards data science for two months of reading all the articles about MLOps. Start with these five tools that work well together and we show you how they're combined. And then if you're unhappy with one of them, you can always swap it on and off after you understand the logic."
50;Jacopo Tagliabue;00:17:20.000;00:17:30.960;00:00:10.960;"Because again, the important thing is understanding the fundamental functional pieces and how they relate together. And then you can make all the personal choices you want about tool A or tool B, once you understand how the flow works."
51;Simba Khadder;00:17:30.960;00:17:38.640;00:00:07.680;"Is there something you built at Tooso that there isn't a good solution for yet, that you'd have to rebuild? Would all of it be replaced by modern infrastructure?"
52;Jacopo Tagliabue;00:17:38.900;00:18:05.090;00:00:25.710;"Most of the thing that Tooso was building and Coveo as well, in the sense of VIMFRA and development, I think they are like 95% percent solved by tools that you have. You need to use them properly again. The other mistake we don't need to go. So one mistake is thinking that you have to build everything yourself. That's false. But the other mistake is that, well, now you have tools and tools are going to do your job. That's false. Tools are going to make you more productive. Tools are going to make you achieve more for less input. But you still need to know how to use the tools."
53;Jacopo Tagliabue;00:18:04.130;00:18:31.550;00:00:26.460;"Snowflake is an amazing tool, but if you don't have good practice on how you store the data and now you replay the data, for example, you're going to lose a lot of properties that Snowflake give you. Metaflow is awesome, but if you don't configure it properly to work with your cloud, it's not going to be the speed up that you need. So there's still a lot of things that you need to do and there's a 5%, you know what I mean? That's a 5% that is left for us to do. But at least you don't have to build or maintain the underlying infra layer, which is not what the company is about."
54;Jacopo Tagliabue;00:18:31.550;00:18:49.690;00:00:18.140;"My client doesn't care about the fact that I use AWS batch or Snowflake or whatever I'm using. They care about the quality of my recommendation. And so I want to focus, my team to focus on the quality of my recommendation, not on the underlying compute, for example, or storage. That's a key point here. But I still have to do a part, yeah."
